{
  "schema": "tiansight.profiles/1",
  "version": "v0.1",
  "issued": "2026-09-07",
  "note": "联合创始人履历库。每条经历都归入 categories 中的一类，每个数字都带出处与证据等级。原始材料为本人提供的 A4 Profile（郭峰、边江），转录后未经第三方核验，等级一律 E4，客户可见前须由本人确认。 公开仓库版本：客户与竞争对手名称已替换为描述，人均价格、门店数量与可识别的产品口号已删除（docs/maintaining.md §6）。",
  "branding": {
    "logo": "../brand/logo.png",
    "wordmark": "侍天 TIANSIGHT",
    "alliance": "A Member of the Table AI Alliance",
    "cobrand_label": "合作方 LOGO 位",
    "cobrand_logo": ""
  },
  "categories": {
    "role": {
      "zh": "任职经历",
      "en": "Role",
      "note": "受雇或合伙的职务，含起止与机构"
    },
    "education": {
      "zh": "教育与认证",
      "en": "Education",
      "note": "学历、学术认证、职业资格"
    },
    "training": {
      "zh": "培训经历",
      "en": "Training",
      "note": "主讲、师资培训、教练课程"
    },
    "case": {
      "zh": "咨询案例",
      "en": "Case",
      "note": "有服务时间、对象与经营结果的项目"
    },
    "brand": {
      "zh": "服务品牌",
      "en": "Brand",
      "note": "服务过的品牌，按品类归组"
    },
    "service": {
      "zh": "服务覆盖",
      "en": "Service",
      "note": "对外提供的服务领域，按方向归组"
    },
    "capability": {
      "zh": "核心能力",
      "en": "Capability",
      "note": "对外承诺可交付的能力项"
    },
    "method": {
      "zh": "原创方法论",
      "en": "Method",
      "note": "自有方法、工具与体系"
    },
    "principle": {
      "zh": "全案原则",
      "en": "Principle",
      "note": "做事准则，三条以内"
    },
    "research": {
      "zh": "学术研究",
      "en": "Research",
      "note": "研究方向与跨界课题"
    },
    "figure": {
      "zh": "关键数字",
      "en": "Key figure",
      "note": "封面与一页版使用的数字，必须有出处"
    }
  },
  "grades": {
    "E1": "直接计量：可从原始系统导出并复算",
    "E2": "抽样推算：样本或阶段数据外推",
    "E3": "外部参照／设计值：引用第三方口径或目标值",
    "E4": "未验证：本人提供，尚未核验"
  },
  "sources": {
    "src-bj-profile": {
      "label": "边江 A4 Profile",
      "kind": "本人提供",
      "date": "2026-09",
      "grade": "E4"
    },
    "src-gf-profile": {
      "label": "郭峰 A4 Profile",
      "kind": "本人提供",
      "date": "2026-09",
      "grade": "E4"
    }
  },
  "profiles": [
    {
      "id": "bian-jiang",
      "order": "壹",
      "name": "边江",
      "en": "BIAN JIANG",
      "domain": "RESTAURANT BRAND STRATEGY",
      "domain_zh": "餐饮品牌与产品结构",
      "photo": "photos/founder-bian-jiang.png",
      "source": "src-bj-profile",
      "title_main": "侍天联合创始人",
      "titles_aux": [
        {
          "zh": "侍天 · 智慧餐饮 主理",
          "en": "Smart F&B",
          "show": true
        },
        {
          "zh": "Table AI 生态合伙人",
          "en": "Table AI Ecosystem Partner",
          "show": true
        },
        {
          "zh": "OPC Global 共创教练",
          "en": "OPC Global Coach",
          "show": true
        },
        {
          "zh": "尖味菜单工作室 创始人",
          "en": "Founder, Menu Studio",
          "show": false
        },
        {
          "zh": "羽生餐饮品牌管理 创始人",
          "en": "Founder, Yusheng Brand Management",
          "show": false
        }
      ],
      "lede": "北大经济学背景，前海底捞品牌负责人，尖味菜单工作室创始人，互联网品牌传播与头部餐饮品牌管理复合经验。",
      "summary": [
        "边江，北大经济学出身，有新浪、网易等互联网公司 6 年品牌传播经验，曾在呷哺呷哺、海底捞做品牌 5 年，任海底捞品牌负责人。后成立羽生餐饮品牌管理有限公司，常年从事品牌管理、产品结构管理及品牌传播的定位、咨询与落地工作。羽生团队成员来自餐饮公司市场总监、广告创意总监及广告公司的资深文案。",
        "在羽生餐饮管理公司时期，边江参与多品牌连锁火锅集团的品牌定位、北方老字号火锅品牌的品牌重塑与每季度菜单分析和菜品结构管理、连锁烤鱼品牌旗下点心子品牌的品牌及产品战略设计等项目，并持续落地执行服务至今。"
      ],
      "quote": "定位方向不正确，每一步都离目标更远。",
      "contact": {
        "wechat": "［微信号］",
        "email": "［bianjiang@tiansight.·］"
      },
      "figures": [
        {
          "id": "bj-fig-brands",
          "type": "figure",
          "value": "100+",
          "unit": "",
          "label": "BRANDS",
          "zh": "全案服务品牌",
          "note": "深入全案服务中国超过 100 个品牌",
          "grade": "E4",
          "source": "src-bj-profile"
        },
        {
          "id": "bj-fig-top50",
          "type": "figure",
          "value": "60",
          "unit": "%",
          "label": "TOP50 COVERAGE",
          "zh": "中国餐饮 TOP50 覆盖",
          "note": "中国餐饮排行 TOP50 中占到 60%",
          "grade": "E4",
          "source": "src-bj-profile"
        }
      ],
      "principles": [
        {
          "id": "bj-pr-1",
          "type": "principle",
          "title": "方向性",
          "body": "定位方向不正确，每一步都离目标更远。"
        },
        {
          "id": "bj-pr-2",
          "type": "principle",
          "title": "系统性",
          "body": "营销是一个体系，不能头痛医头、脚痛医脚。"
        },
        {
          "id": "bj-pr-3",
          "type": "principle",
          "title": "落地性",
          "body": "没有真枪实弹落地执行，再好的仗也打不赢。"
        }
      ],
      "capabilities": [
        {
          "id": "bj-cap-1",
          "type": "capability",
          "title": "品牌定位与重塑"
        },
        {
          "id": "bj-cap-2",
          "type": "capability",
          "title": "产品结构与利润模型"
        },
        {
          "id": "bj-cap-3",
          "type": "capability",
          "title": "君王产品设计"
        },
        {
          "id": "bj-cap-4",
          "type": "capability",
          "title": "菜单体系与场景组合"
        },
        {
          "id": "bj-cap-5",
          "type": "capability",
          "title": "全案落地与经营跟进"
        }
      ],
      "brands": [
        {
          "id": "bj-br-hotpot",
          "type": "brand",
          "group": "火锅",
          "items": [
            "6 个品牌"
          ]
        },
        {
          "id": "bj-br-bbq",
          "type": "brand",
          "group": "烧烤",
          "items": [
            "4 个品牌"
          ]
        },
        {
          "id": "bj-br-fast",
          "type": "brand",
          "group": "快餐",
          "items": [
            "8 个品牌"
          ]
        },
        {
          "id": "bj-br-casual",
          "type": "brand",
          "group": "简餐",
          "items": [
            "4 个品牌"
          ]
        },
        {
          "id": "bj-br-banquet",
          "type": "brand",
          "group": "小宴",
          "items": [
            "3 个品牌"
          ]
        },
        {
          "id": "bj-br-drinks",
          "type": "brand",
          "group": "饮品",
          "items": [
            "2 个品牌"
          ]
        },
        {
          "id": "bj-br-buzz",
          "type": "brand",
          "group": "网红餐厅",
          "items": [
            "3 个品牌"
          ]
        },
        {
          "id": "bj-br-blackpearl",
          "type": "brand",
          "group": "黑珍珠餐厅",
          "items": [
            "4 个品牌"
          ]
        },
        {
          "id": "bj-br-michelin",
          "type": "brand",
          "group": "米其林餐厅",
          "items": [
            "2 个品牌"
          ]
        }
      ],
      "roles": [
        {
          "id": "bj-role-1",
          "type": "role",
          "org": "新浪、网易",
          "title": "品牌传播",
          "period": "6 年",
          "note": "互联网品牌传播"
        },
        {
          "id": "bj-role-2",
          "type": "role",
          "org": "呷哺呷哺、海底捞",
          "title": "品牌负责人",
          "period": "5 年",
          "note": "海底捞品牌负责人（本人确认的职务表述，2026-10-14）"
        },
        {
          "id": "bj-role-3",
          "type": "role",
          "org": "羽生餐饮品牌管理有限公司",
          "title": "创始人",
          "period": "至今",
          "note": "品牌管理、产品结构管理、品牌传播定位与落地"
        },
        {
          "id": "bj-role-4",
          "type": "role",
          "org": "尖味菜单工作室",
          "title": "创始人",
          "period": "至今",
          "note": "菜单体系与产品结构"
        }
      ],
      "education": [
        {
          "id": "bj-edu-1",
          "type": "education",
          "org": "北京大学",
          "title": "经济学",
          "period": ""
        }
      ],
      "cases": [
        {
          "id": "bj-case-a",
          "type": "case",
          "title": "北方老字号火锅品牌",
          "en": "SELECTED CASE",
          "facts": [
            {
              "k": "服务时间",
              "v": "2016 年"
            },
            {
              "k": "品牌所在地",
              "v": "华北"
            },
            {
              "k": "品类",
              "v": "火锅"
            },
            {
              "k": "业态",
              "v": "直营连锁"
            }
          ],
          "strategy": "以核心肉品为主系列，以传统手工技艺为背书，树立高价值的手工系列，替换原低毛利系列；以可视化的出品表达加大产品价值感与市场教育。根据原材料能力开发地方小吃系列，增加口味和产品的场景搭配，增强午餐与夜宵时段吸引力。",
          "results": [
            {
              "id": "bj-r-a-1",
              "metric": "手切羊肉点击率",
              "value": "+15.3%",
              "window": "年同比",
              "grade": "E4",
              "source": "src-bj-profile"
            },
            {
              "id": "bj-r-a-2",
              "metric": "羊肉类客单价",
              "value": "+14%",
              "window": "平均",
              "grade": "E4",
              "source": "src-bj-profile"
            },
            {
              "id": "bj-r-a-3",
              "metric": "整体单均销售",
              "value": "+24%",
              "window": "调整后",
              "grade": "E4",
              "source": "src-bj-profile"
            }
          ],
          "show_in": [
            "full",
            "onepage"
          ],
          "capabilities": [
            "bj-cap-1",
            "bj-cap-2",
            "bj-cap-3"
          ]
        },
        {
          "id": "bj-case-b",
          "type": "case",
          "title": "华东连锁中式快餐品牌",
          "en": "SELECTED CASE",
          "facts": [
            {
              "k": "服务时间",
              "v": "2017 年"
            },
            {
              "k": "品牌所在地",
              "v": "华东"
            },
            {
              "k": "品类",
              "v": "中式快餐"
            },
            {
              "k": "业态",
              "v": "连锁"
            }
          ],
          "strategy": "面对区域头部快餐品牌的竞争，改变产品赛道，重新确立以小份蒸菜为君王产品系列，以汤品为佐类形成差异，构建多样性的产品组合搭配策略。蒸菜中聚焦地方菜工艺，确定一条肉类系列为核心产品。",
          "results": [
            {
              "id": "bj-r-b-1",
              "metric": "销售同比增长",
              "value": "+58%",
              "window": "2017–2018",
              "grade": "E4",
              "source": "src-bj-profile"
            },
            {
              "id": "bj-r-b-2",